{
  "$schema": "https://json-schema.org/draft/2020-12/schema",
  "$id": "https://raw.githubusercontent.com/shimpeiws/gatefold/main/schema/claim-result.v4.json",
  "title": "Gatefold trace-comparison result",
  "description": "Machine-readable claim collection emitted by gatefold compare-traces --format json. Version 4 describes a two-trace A -> B comparison: every evidence reference names which input trace its pointer resolves against, and per-trace metadata lives in the inputs map.",
  "type": "object",
  "additionalProperties": false,
  "required": ["schemaVersion", "source", "inputs", "claims"],
  "properties": {
    "schemaVersion": {
      "type": "integer",
      "const": 4,
      "description": "Version of this result schema. Additive changes keep the version; structural changes bump it."
    },
    "source": {
      "type": "object",
      "additionalProperties": false,
      "required": ["command"],
      "description": "Identifies this result as a two-trace comparison. No single yuureiVersion is recorded here because the inputs may carry different versions; see inputs.",
      "properties": {
        "command": {
          "type": "string",
          "const": "compare-traces"
        }
      }
    },
    "inputs": {
      "type": "object",
      "additionalProperties": false,
      "required": ["beforeTrace", "afterTrace"],
      "description": "Descriptors of the two validated input traces, keyed by their role in the comparison.",
      "properties": {
        "beforeTrace": { "$ref": "#/$defs/traceInput" },
        "afterTrace": { "$ref": "#/$defs/traceInput" }
      }
    },
    "claims": {
      "type": "array",
      "items": { "$ref": "#/$defs/claim" }
    }
  },
  "$defs": {
    "traceInput": {
      "type": "object",
      "additionalProperties": false,
      "required": [
        "label",
        "document",
        "schemaVersion",
        "runId",
        "startedAt",
        "finishedAt",
        "runtimeId",
        "runtimeVersion",
        "modelRequested",
        "modelResolved",
        "profileName",
        "profileDigest",
        "taskSource",
        "taskDigest",
        "isolationStrategy",
        "isolationVerified"
      ],
      "properties": {
        "label": {
          "type": "string",
          "minLength": 1,
          "description": "The input argument as supplied, or '<stdin>'."
        },
        "document": { "type": "string", "const": "yuurei-trace" },
        "schemaVersion": {
          "type": "string",
          "description": "The trace's schema_version compatibility token, compared for equality (currently '0.3')."
        },
        "runId": { "type": "string", "minLength": 1 },
        "yuureiVersion": {
          "type": "string",
          "description": "yuurei_version of the trace; absent when the trace does not carry it."
        },
        "startedAt": { "type": "string" },
        "finishedAt": { "type": "string" },
        "runtimeId": { "type": "string", "minLength": 1 },
        "runtimeVersion": {
          "type": ["string", "null"],
          "description": "runtime.version of the trace; null is preserved as null."
        },
        "modelRequested": { "type": "string", "minLength": 1 },
        "modelResolved": {
          "type": ["string", "null"],
          "description": "model.resolved of the trace; null means the effective model was not observed."
        },
        "modelResolvedReason": {
          "type": "string",
          "enum": ["observed", "unobserved", "parse_failed"],
          "description": "model.resolved_reason of the trace; absent when the trace does not carry it."
        },
        "profileName": { "type": "string" },
        "profileDigest": { "type": "string", "minLength": 1 },
        "taskSource": { "type": "string" },
        "taskDigest": { "type": "string", "minLength": 1 },
        "isolationStrategy": { "type": "string", "minLength": 1 },
        "isolationVerified": { "type": "boolean" },
        "requestedCellDigest": {
          "type": "string",
          "description": "requested_cell.digest of the trace; absent when the trace does not carry it."
        },
        "requestedCellInputsVersion": {
          "type": "integer",
          "description": "requested_cell.inputs_version of the trace; absent when the trace does not carry it."
        },
        "executionOptions": {
          "type": "object",
          "description": "The trace's execution_options value recorded verbatim; absent when the trace does not carry it."
        },
        "definition": {
          "type": "object",
          "description": "The trace's definition value recorded verbatim ({ run: string | null, cli_overrides: string[] }); absent when the trace does not carry it."
        }
      }
    },
    "claim": {
      "type": "object",
      "additionalProperties": false,
      "required": ["claim", "ruleId", "evidence", "provenance", "confidence"],
      "properties": {
        "claim": {
          "type": "string",
          "minLength": 1,
          "description": "A single descriptive statement about the comparison. Never a judgement of quality."
        },
        "ruleId": {
          "type": "string",
          "minLength": 1,
          "description": "Stable identifier of the rule that produced this claim. Required in v4; all v4 results are produced by this release or later."
        },
        "evidence": {
          "type": "array",
          "minItems": 1,
          "items": { "$ref": "#/$defs/evidenceReference" },
          "description": "References into the two input traces that support the claim. A claim without evidence is invalid."
        },
        "provenance": { "$ref": "#/$defs/provenance" },
        "confidence": {
          "type": "number",
          "minimum": 0,
          "maximum": 1,
          "description": "Certainty that the evidence supports the claim. 1 = fully supported. Not a harness quality score."
        }
      }
    },
    "evidenceReference": {
      "type": "object",
      "additionalProperties": false,
      "required": ["source", "pointer"],
      "properties": {
        "source": {
          "type": "string",
          "enum": ["beforeTrace", "afterTrace"],
          "description": "Which of the two input traces the pointer resolves against."
        },
        "pointer": {
          "type": "string",
          "pattern": "^$|^(?:/(?:[^/~]|~0|~1)*)*$",
          "description": "JSON Pointer (RFC 6901) into the trace named by source. The empty string references the whole document."
        },
        "elementId": {
          "type": "string",
          "minLength": 1,
          "description": "Identifier of the referenced element, verbatim from the input document. Unused by trace claims: a trace has no element ids."
        },
        "note": {
          "type": "string",
          "description": "Optional human-readable clarification of what the reference shows, for example naming a field absent at the pointed location."
        }
      }
    },
    "provenance": {
      "type": "object",
      "additionalProperties": false,
      "required": ["transform"],
      "description": "Per-trace metadata (file labels, versions, run ids) lives in the top-level inputs map because a comparison claim can cite both traces.",
      "properties": {
        "transform": {
          "type": "array",
          "items": { "type": "string" },
          "description": "Names of the transformations applied between the raw inputs and this claim, in application order. Empty when the claim reads the inputs directly."
        }
      }
    }
  }
}
